ASIN,product_name,price,listPrice,detailPageURL,rating,totalReviews,product_company,isPrimeEligible,Category
B07CTSS14R,"ogx coffee scrub and wash, coconut 19.5 fl oz",$6.97 ($0.36 / Fl Oz),$9.29 ($0.48 / Fl Oz),https://www.amazon.com/dp/B07CTSS14R,4.7,49394.0,ogx,1.0,body scrub
B07YYYSHVB,"ogx hydration + sea kelp & hyaluronic acid sulfate-free lightly moisturizing body scrub with black rice, gentle exfoliating daily body wash to soften & smooth skin, 19.5 fl oz",$6.99 ($0.36 / Fl Oz),$9.29 ($0.48 / Fl Oz),https://www.amazon.com/dp/B07YYYSHVB,4.6,12698.0,ogx,1.0,body scrub
B09PJ3CPVH,"ogx sensitive + pink sea salt & rosewater sulfate-free soothing body scrub with healing rose quartz, gentle exfoliating daily body wash to soften & smooth skin, 19.5 fl oz (pack of 3)",$18.67 ($0.32 / Fl Oz),$20.92 ($0.36 / Fl Oz),https://www.amazon.com/dp/B09PJ3CPVH,4.5,26727.0,ogx,1.0,body scrub
1517372402,oil pulling: oil pulling beginner's guide! - learn how to heal your body using nature's ancient detoxifying and healing oil pulling oral detox therapy cleansing!,$4.76,$6.99,https://www.amazon.com/dp/1517372402,4.2,10.0,"brooks, sarah (paperback)",1.0,cleansing oil
B01MDS34NI,"o'keeffe's cooling relief lip repair lip balm for dry, cracked lips, stick, (pack of 2)",$6.47 ($21.57 / Ounce),$9.99 ($33.30 / Ounce),https://www.amazon.com/dp/B01MDS34NI,4.7,4307.0,o'keeffe's cooling relief lip,1.0,lipbalm
B01MG64OK2,"o'keeffe's unscented lip repair lip balm for dry, cracked lips, stick, (pack of 3)",$13.99 ($31.09 / Ounce),,https://www.amazon.com/dp/B01MG64OK2,4.6,2028.0,o'keeffe's unscented lip repair,1.0,lipbalm
B07N4PVLB7,"o'keeffe's unscented lip repair lip balm for dry, cracked lips, stick, twin pack",$9.99 ($33.30 / Ounce),,https://www.amazon.com/dp/B07N4PVLB7,4.6,10867.0,o'keeffe's unscented lip repair,1.0,lipbalm
B01KJGBEYK,oklahoma joe's longhorn reverse flow offset smoker - 17202053,$799.00,,https://www.amazon.com/dp/B01KJGBEYK,4.5,413.0,oklahoma joe's longhorn reverse,1.0,eye cream
B09MN94BZW,"ola loko mud mask, clay mask for face and skin, detox mask skin care, exfoliating face mask, deeply cleans and purify pores for clear and glowing skin, 8.5 fl oz",$6.99 ($0.82 / Ounce),$8.99 ($1.06 / Ounce),https://www.amazon.com/dp/B09MN94BZW,4.2,169.0,ola loko,1.0,clay mask
B01M68DG5Q,"olay regenerist detoxifying pore scrub cleanser, 5.0 fluid ounce",$7.48 ($1.50 / Fl Oz),,https://www.amazon.com/dp/B01M68DG5Q,4.7,471.0,olay,1.0,face scrub
B07YZMMH8Q,"olay regenerist micro-sculpting serum, 2-pack, ultra-lightweight anti-aging moisturizer, 100ml (3.4 fl oz) total",$40.95 ($6.02 / Fl Oz),$52.95 ($7.79 / Fl Oz),https://www.amazon.com/dp/B07YZMMH8Q,4.7,1113.0,olay,1.0,serum
B07XQVT3TZ,"olay regenerist retinol 24 night eye cream, 0.5oz + whip face moisturizer travel/trial size bundle",$24.97,$27.99,https://www.amazon.com/dp/B07XQVT3TZ,4.5,2305.0,olay,1.0,eye cream
B0039NMCPG,"olay regenerist serum, 1.7 fl oz",$20.66 ($12.15 / Fl Oz),$27.49 ($16.17 / Fl Oz),https://www.amazon.com/dp/B0039NMCPG,4.7,5316.0,olay,1.0,serum
B09CDXHG9N,"olay regenerist vitamin c + peptide 24 brightening face moisturizer for brighter skin, lightweight anti-aging cream for dark spots, includes olay whip travel size for dry, 1.7 oz",$29.99 ($17.64 / Ounce),$34.99 ($20.58 / Ounce),https://www.amazon.com/dp/B09CDXHG9N,4.6,5770.0,olay regenerist vitamin c,1.0,moisturizer
B0C7MQQSW4,"olay super serum 1.0 oz with niacinamide, vitamin c, collagen peptide, aha, and vitamin e",$29.94,$34.99,https://www.amazon.com/dp/B0C7MQQSW4,4.1,15.0,olay,1.0,serum
B01LTI0948,"olay total effects citrus facial cleanser and scrub, 5 fl oz (pack of 3)",$22.44 ($1.50 / Fl Oz),,https://www.amazon.com/dp/B01LTI0948,4.7,1770.0,olay,1.0,face scrub
B01EHW5JYI,"olay ultimate eye cream for wrinkles, puffy eyes + dark circles, 0.4oz/13ml",$29.97 ($74.92 / Ounce),,https://www.amazon.com/dp/B01EHW5JYI,4.3,11526.0,olay,1.0,eye cream
B01HPYRYU2,onwon 100 pcs diy white color natural spa skin care skin fiber paper pre-cut facial paper sheet facial mask,$9.80 ($0.10 / Count),$12.99 ($0.13 / Count),https://www.amazon.com/dp/B01HPYRYU2,4.3,1604.0,onwon,1.0,sheet mask
B01N43NOYP,optase moist heat eye mask - washable and reusable heated & cooling gel eye mask - hydrobead technology for dry eye relief,$19.79 ($19.79 / Count),$24.95 ($24.95 / Count),https://www.amazon.com/dp/B01N43NOYP,4.5,4092.0,optase moist heat eye,1.0,eye mask
B06Y2YWVT3,"optase tea tree oil eyelid wipes - eyelid cleansing wipes for dry eyes - tea tree wipes for blepharitis treatment - preservative free, natural ingredients - step 2 cleanse - tto eye wipes, box of 20",$16.96 ($0.85 / Count),$24.95 ($1.25 / Count),https://www.amazon.com/dp/B06Y2YWVT3,4.5,2594.0,optase tea tree oil,1.0,cleansing oil
B0C7FPNH48,"orange exfoliating whitening gel, gmeelan orange exfoliating whitening gel, gmeelan exfoliating gel, orange exfoliating gel face whitening, gluta whitening lazy cream korean (2 bottle)",$11.99 ($6.00 / Ounce),,https://www.amazon.com/dp/B0C7FPNH48,3.9,20.0,wsrchh,1.0,exfoliator
B0C1L58QZ6,"orangeroses - 10 pcs combo vital ampoule sheet mask, korean facial skincare sheet | simple & effective skincare routine | moisturization | wrinkle care | brightening (10 pcs combo)",$6.45 ($0.64 / Count),,https://www.amazon.com/dp/B0C1L58QZ6,4.8,15.0,orangeroses,1.0,sheet mask
B006E5A3PW,org body scrub deep gel exfoliator for glowing and smooth skin - korean exfoliating peel skincare - natural cruelty free formulation for sensitive skin 6oz,$35.50 ($5.92 / Fl Oz),$38.00 ($6.33 / Fl Oz),https://www.amazon.com/dp/B006E5A3PW,4.4,1789.0,o.r.g. skincare,1.0,exfoliator
B016SCEN06,"orgaid organic sheet mask | made in usa (anti-aging & moisturizing, pack of 4)",$26.00 ($6.50 / Count),,https://www.amazon.com/dp/B016SCEN06,4.6,506.0,orgaid,1.0,sheet mask
B08LW5NCK1,"organic coffee body scrub - coffee scrub & sugar scrub body polish, exfoliating body scrub exfoliator & foot scrub, body exfoliator, body scrubs for women exfoliation, sugar scrubs for women & men",$24.99 ($2.50 / Ounce),$29.99 ($3.00 / Ounce),https://www.amazon.com/dp/B08LW5NCK1,4.4,820.0,beauty by earth,1.0,body scrub
B00WMM74VW,"organic lip balm by sierra bees - moisturizing balm for chapped lips - featuring sustainably sourced beeswax, olive oil, sunflower oil, & vitamin e - cruelty free, non-gmo - variety 8 pack",$9.79,,https://www.amazon.com/dp/B00WMM74VW,4.6,410.0,sierra bees,0.0,lipbalm
B01LX8UFRB,"organic lip balm for men, mens chapstick organic, mens lip balm, natural chapstick for men, organic chapstick mint lip balm, peppermint lip balm, all natural men's lip balm chap stick, lip therapy",$19.95 ($4.99 / Count),,https://www.amazon.com/dp/B01LX8UFRB,4.6,1608.0,rugged & dapper,1.0,lipbalm
B00QMR4ZNI,"organic lip balm pack - usa made lip balm bulk lip care products, unflavored natural lip balm, hydrating lip balm birthday gifts for men, lipbalm stocking stuffers for men gifts, small gifts for women",$11.99 ($3.00 / Count),,https://www.amazon.com/dp/B00QMR4ZNI,4.6,7065.0,beauty by earth,1.0,lipbalm
B08CGW8CP1,"organic pink watermelon body scrub, pure natural gentle exfoliator for smooth & soft skin, best shower exfoliating salt skincare scrub, hydrating & moisturizing face foot hands, great gift for women",$11.97 ($1.20 / Ounce),,https://www.amazon.com/dp/B08CGW8CP1,4.0,3049.0,white naturals,1.0,body scrub
B076JK83C9,organys cleansing oil and makeup remover face wash,$21.00 ($2.62 / Fl Oz),,https://www.amazon.com/dp/B076JK83C9,4.5,1672.0,organys,1.0,cleansing oil
B094V58GFC,origins checks and balances face scrub unisex scrub 2.5 oz,$26.20 ($10.48 / Ounce),,https://www.amazon.com/dp/B094V58GFC,4.5,42.0,origins,1.0,face scrub
B017NPXX9E,"origins original skin retexturizing mask with rose clay, 2.5 fl oz (pack of 1)",$29.88 ($11.95 / Fl Oz),,https://www.amazon.com/dp/B017NPXX9E,4.7,191.0,origins,1.0,clay mask
B00URD72DI,"origins plantscription anti-aging power eye cream, 0.5 fl oz (oricosc74200104)",$40.95 ($81.90 / Fl Oz),$50.00 ($100.00 / Fl Oz),https://www.amazon.com/dp/B00URD72DI,4.6,401.0,origins,1.0,eye cream
B002W8SP0A,osea salts of the earth body scrub | gently exfoliate & soften skin | naturally derived seaweed skincare | vegan & cruelty-free,$48.00 ($4.00 / Ounce),$51.00 ($4.25 / Ounce),https://www.amazon.com/dp/B002W8SP0A,4.5,208.0,osea,1.0,body scrub
B09KLVLS13,"ostrich pillow eye mask | 3d ergonomic mask | adjusts to the shape of your face | mask for sleeping, resting, relaxing | blocks light for total darkness (dark night)",$45.00,,https://www.amazon.com/dp/B09KLVLS13,4.3,110.0,ostrich pillow eye mask,1.0,eye mask
B07H52SVM7,"ouai scalp & body scrub - deep-cleansing scrub for hair & skin - removes build-up, exfoliates & moisturizes with sugar & coconut oil - free of parabens, sulfates & phthalates - 8.8 fl oz",$40.00 ($4.55 / Ounce),,https://www.amazon.com/dp/B07H52SVM7,4.6,1470.0,ouai,1.0,body scrub
B07VRTP6SY,"pacifica beauty, glow baby booster serum for face, vitamin c and glycolic acid, brightens and supports, for all skin types, fragrance free, clean skin care, vegan and cruelty free , 1 fl oz",$15.99,,https://www.amazon.com/dp/B07VRTP6SY,4.5,2355.0,pacifica,1.0,serum
B08RQRGV79,"pacifica beauty, stress rehab coconut & caffeine face mask, sheet mask, de-stress, reduce puffiness & redness, for all skin types, green tea, vegan",$3.99,,https://www.amazon.com/dp/B08RQRGV79,4.6,63.0,pacifica,1.0,sheet mask
B07PG5MG98,pacifica cosmic clay face mask unisex 1.18 oz,$6.00 ($5.08 / Ounce),,https://www.amazon.com/dp/B07PG5MG98,4.6,277.0,pacifica,1.0,clay mask
B09329B5KK,pacifica disobey time facial mask - rose and peptide 1 pc,$4.00,,https://www.amazon.com/dp/B09329B5KK,4.7,31.0,pacifica,1.0,sheet mask
B0BRXJZJD4,pack of 3 x clinique take the day off charcoal cleansing balm 0.5 oz/15ml total 1.5 oz/45 ml,$6.23 ($4.15 / Ounce),$6.90 ($4.60 / Ounce),https://www.amazon.com/dp/B0BRXJZJD4,4.6,14.0,clinique,1.0,cleansing balm
B093XQJC5C,"pack of 3 x clinique take the day off cleansing balm, 0.5 oz each sample size unboxed, 0.5 ounce (pack of 3)",$14.97 ($4.99 / Fl Oz),,https://www.amazon.com/dp/B093XQJC5C,4.7,50.0,clinique,1.0,cleansing balm
B09V154ZM2,"painistic green tea mask stick blackhead remover, purifying oil control clean solid face clay mask moisturizing acne deep pore cleansing for all skin types of men and women",$6.99 ($4.11 / Ounce),$8.89 ($5.23 / Ounce),https://www.amazon.com/dp/B09V154ZM2,4.0,871.0,painistic,1.0,clay mask
B01N34OR3T,"palmer's cocoa butter formula ultra gentle facial cleansing oil, 6.5 ounces",$16.95 ($2.61 / Ounce),,https://www.amazon.com/dp/B01N34OR3T,4.3,2806.0,palmer's,1.0,cleansing oil
B00W2CTHT4,"palmer's cocoa butter skin therapy cleansing facial oil, gentle makeup remover for face, rosehip fragrance, 6.5 ounce",$9.99 ($1.54 / Fl Oz),$11.99 ($1.84 / Fl Oz),https://www.amazon.com/dp/B00W2CTHT4,4.5,7384.0,palmer's,1.0,cleansing oil
B07L1DVWT9,"palmer's coconut oil formula coconut sugar facial scrub exfoliator, face scrub to gently exfoliate away dirt and dead skin cells with chamomile to soften & calm, 3.17 ounces (pack of 1)",$8.99 ($2.84 / Ounce),$9.88 ($3.12 / Ounce),https://www.amazon.com/dp/B07L1DVWT9,4.6,18693.0,palmer's,1.0,exfoliator
B07MBHRYTJ,"palmer's coconut oil formula lip balm duo with spf 15 and vitamin e, all-day moisturizing sunscreen lip balm, hydrates dry, cracked lips (pack of 2)",$2.88 ($1.80 / Ounce),,https://www.amazon.com/dp/B07MBHRYTJ,4.3,16329.0,palmer's,1.0,lipbalm
B07953SZND,"palmer's coconut oil formula, coconut monoi facial cleansing balm and makeup remover, 2.25 ounces",$8.99 ($4.00 / Ounce),,https://www.amazon.com/dp/B07953SZND,4.5,964.0,palmer's,1.0,cleansing balm
B081KL2QYJ,"panoxyl acne foaming wash benzoyl peroxide 10% maximum strength antimicrobial, 5.5 oz",$9.77 ($1.78 / Ounce),,https://www.amazon.com/dp/B081KL2QYJ,4.6,52644.0,panoxyl,1.0,cleanser
B016FTEW9Y,"papa recipe bombee sheet mask, korean moisturizing honey mask pack for dehydrated and sensitive skin 10 sheets (yellow)",$15.95 ($1.60 / Count),$19.97 ($2.00 / Count),https://www.amazon.com/dp/B016FTEW9Y,4.6,733.0,papa recipe right for skin,1.0,sheet mask
B079TSX3Y2,"patchology ""soothe flashmasque facial sheet mask with aloe vera - men and women face masks skincare sheet for moisturizing and hydrating skin in 5 minutes - best face sheets moisturizer (4 count)",$29.99 ($7.50 / Count),,https://www.amazon.com/dp/B079TSX3Y2,4.7,290.0,"patchology ""soothe flashmasque facial",1.0,sheet mask
B07VXKFVL2,"paula's choice - clear purifying clay face mask with oil absorbing bentonite, kaolin & salicylic acid, minimizes large pores & redness, for oily & acne-prone skin, 3 ounces",$29.00 ($9.67 / Fl Oz),,https://www.amazon.com/dp/B07VXKFVL2,4.7,195.0,paula's choice,1.0,clay mask
B0BLT9NHKF,"paula's choice c5 super boost eye cream with 5% vitamin c, hyaluronic acid & peptides, for puffy eyes, dark circles, fine lines & crow’s feet, 0.5 fl oz ",$39.00 ($78.00 / Fl Oz),,https://www.amazon.com/dp/B0BLT9NHKF,4.2,117.0,paula's choice,1.0,eye cream
B0BHTY6RZ5,"paula's choice calm ultra-gentle cleanser for sensitive skin, calms + soothes redness, daily face wash for rosacea-prone & eczema-prone skin, fragrance-free & paraben-free, 6.7 fl oz.",$19.00 ($2.84 / Fl Oz),,https://www.amazon.com/dp/B0BHTY6RZ5,4.6,147.0,paula's choice,1.0,cleanser
B07HZWXGJ7,"paula's choice clear oil-free moisturizer, lightweight face moisturizer for acne-prone skin, pore-minimizing niacinamide, soothing antioxidants, ceramides to calm redness",$29.00 ($14.50 / Fl Oz),,https://www.amazon.com/dp/B07HZWXGJ7,4.6,1483.0,paula's choice,1.0,moisturizer
B06ZYNQZKF,"paula's choice clear pore normalizing cleanser, salicylic acid acne face wash, redness & blackheads, 6 ounce",$15.00,,https://www.amazon.com/dp/B06ZYNQZKF,4.6,5857.0,paula's choice,1.0,cleanser
B00AFYAXEO,"paula's choice clear regular strength exfoliator, 2% salicylic acid exfoliant for acne, redness relief, 4 ounce",$34.00 ($8.50 / Fl Oz),,https://www.amazon.com/dp/B00AFYAXEO,4.5,1414.0,paula's choice,1.0,exfoliator
B08ZC7JW3Z,"paula's choice omega complex cleansing balm, double cleanse face wash & daily makeup remover, suitable for dry & sensitive skin, mineral oil-free, paraben-free & fragrance-free, 3.5 fl oz",$29.00 ($8.29 / Ounce),,https://www.amazon.com/dp/B08ZC7JW3Z,4.6,470.0,paula's choice,1.0,cleansing balm
B00DH209KO,"paula's choice resist optimal results hydrating cleanser, green tea & chamomile, anti-aging face wash, dry skin, 6.4 ounce",$22.00 ($3.44 / Fl Oz),,https://www.amazon.com/dp/B00DH209KO,4.5,1203.0,paula's choice,1.0,cleanser
B00NGGEZIS,"paula's choice resist perfectly balanced foaming cleanser, hyaluronic acid & aloe, anti-aging face wash, large pores & oily skin, 6.4 ounce",$22.00 ($3.44 / Fl Oz),,https://www.amazon.com/dp/B00NGGEZIS,4.5,3271.0,paula's choice,1.0,cleanser
B07D8DBS7S,"paula's choice skin perfecting 2% bha liquid salicylic acid exfoliant duo, gentle exfoliator for blackheads, large pores, wrinkles & fine lines, includes 1 full size bottle & 1 travel size bottle",$42.00 ($21.00 / Count),$47.00 ($23.50 / Count),https://www.amazon.com/dp/B07D8DBS7S,4.7,2227.0,paula's choice,1.0,exfoliator
B07TK4D5VD,"paula's choice skin perfecting 8% aha gel exfoliant & 2% bha liquid duo - facial exfoliants for blackheads, enlarged pores, wrinkles, and fine lines w/glycolic and salicylic acid",$68.00 ($9.32 / Fl Oz),,https://www.amazon.com/dp/B07TK4D5VD,4.5,5941.0,paula's choice,1.0,exfoliator
B008EPPPDK,"paula's choice skin recovery replenishing facial moisturizer cream with hyaluronic acid, soothes redness & sensitive skin prone to rosacea & eczema, paraben-free & fragrance-free, 2 fl oz",$33.00 ($16.50 / Fl Oz),,https://www.amazon.com/dp/B008EPPPDK,4.4,1155.0,paula's choice,1.0,moisturizer
B0CDTSJ94B,"paulas choice-skin perfecting 2% bha liquid salicylic acid exfoliant-facial exfoliant for blackheads, enlarged pores, wrinkles & fine lines, 4 oz bottle",$17.47 ($4.37 / Fl Oz),$27.95 ($6.99 / Fl Oz),https://www.amazon.com/dp/B0CDTSJ94B,,,generic,1.0,exfoliator
B08H4QPM19,peach & lily glass skin serum,$39.00 ($28.89 / Fl Oz),,https://www.amazon.com/dp/B08H4QPM19,4.6,183.0,peach & lily,1.0,serum
B0B4T7HTKD,"peach oil body scrub - moisturizing shea butter, saffron & nourishing body oils - exfoliating salt scrub for body -win against aging, stretch marks, cellulite, acne & dead skin scars- 10 oz",$8.99,,https://www.amazon.com/dp/B0B4T7HTKD,3.9,110.0,artnaturals,1.0,body scrub
B09CBF7ZCY,peach slices | acne exfoliating toner | 2% salicylic acid | aha+bha exfoliation | facial cleanser | calms & soothes | prevents breakouts | alcohol & sulfate free | skin care for women & men | 4 oz,$10.99 ($2.75 / Fl Oz),,https://www.amazon.com/dp/B09CBF7ZCY,4.5,1613.0,peach slices | acne,1.0,exfoliator
B0BWYWRP5R,"peauamie exfoliating body scrub marshmallow scrub for acne, dark spots, hyperpigmentation, smooth skin,moisturizing and exfoliating body, face, hand, foot scrub,deep cleansing",$5.99 ($0.68 / Ounce),,https://www.amazon.com/dp/B0BWYWRP5R,4.4,33.0,peauamie,1.0,body scrub
B0B1WS14XH,"peauamie travel face serum set vitamin c serum,hyaluronic acid serum,retinol serum for dark spots, fine lines and wrinkles(5ml/3 pack)",$3.99 ($7.98 / Fl Oz),,https://www.amazon.com/dp/B0B1WS14XH,4.0,223.0,peauamie,1.0,serum
B0BS8Y2FLK,"peauamie under eye patches (30 pairs) gold eye mask and hyaluronic acid eye patches for puffy eyes,rose eye masks for dark circles and puffiness under eye treatment skin care products…",$9.99 ($9.99 / Count),,https://www.amazon.com/dp/B0BS8Y2FLK,4.6,680.0,peauamie,1.0,eye mask
B0B22TJCZ7,"penebella new - 3% caffeine eye cream - 5% niacinamide (vitamin b3) under eye cream for dark circle, puffiness & wrinkles - brighten & repair anti aging eye treatment balm - moisturizer with collagen",$9.99 ($19.98 / Ounce),,https://www.amazon.com/dp/B0B22TJCZ7,4.4,1328.0,penebella,1.0,eye cream
B07M7KQGS9,"permotary 30 pairs 24k gold gel crystal collagen under eye pads mask for moisturizing,reducing fine lines&dark circles& puffy eyes patch for women men, gold",$9.99 ($0.33 / Count),$15.99 ($0.53 / Count),https://www.amazon.com/dp/B07M7KQGS9,4.4,6193.0,permotary,1.0,eye mask
B09HWKPXRJ,"perricone md cold plasma plus+ concentrated treatment sheet mask, 1 ct.",$22.00,,https://www.amazon.com/dp/B09HWKPXRJ,4.5,39.0,perricone md cold plasma,1.0,sheet mask
B004P2LL2K,"peter thomas roth | instant firmx temporary eye tightener | firm and smooth the look of fine lines, 1 oz (pack of 1",$28.50,$38.00,https://www.amazon.com/dp/B004P2LL2K,3.8,11620.0,peter thomas roth |,1.0,eye cream
B07FTH5ZPV,"philosophy purity made simple - eye cream, 0.5 oz (pack of 1)",$25.00 ($50.00 / Fl Oz),,https://www.amazon.com/dp/B07FTH5ZPV,4.5,518.0,philosophy purity made simple,1.0,eye cream
B075GYJH7G,"philosophy purity made simple - pore extractor mask, 1 oz",$21.00,,https://www.amazon.com/dp/B075GYJH7G,4.5,408.0,philosophy purity made simple,1.0,clay mask
B086CLPYGL,"philosophy purity made simple one-step facial cleanser, 16 fl. oz.",$38.00 ($2.38 / Fl Oz),$42.00 ($2.62 / Fl Oz),https://www.amazon.com/dp/B086CLPYGL,4.8,2729.0,philosophy purity made simple,1.0,cleanser
B0BS4JT9NN,phoera makeup remover cleansing balm with sweet orange essential oil makeup meltaway cleansing balm (20g balm),$8.49 ($0.42 / Ounce),$8.99 ($0.45 / Ounce),https://www.amazon.com/dp/B0BS4JT9NN,4.8,7.0,phoera,1.0,cleansing balm
B07MNZ7WTR,"physicians formula face cleansing balm the perfect matcha 3-in-1 makeup remover for eye, lip, or face, deeply cleanses pores and removes impurities, ultra nourishing soothing treatment",$14.42 ($10.30 / Ounce),,https://www.amazon.com/dp/B07MNZ7WTR,4.4,3297.0,physicians formula,1.0,cleansing balm
B07W32YTPH,"physicians formula rosé all day to night eye cream, dark circles, puffiness, bags under eyes, wrinkles | dermatologist tested, clinicially tested",$13.07 ($26.14 / Ounce),$17.49 ($34.98 / Ounce),https://www.amazon.com/dp/B07W32YTPH,4.6,169.0,physicians formula,1.0,eye cream
B09Z7FK957,"pina colada body scrub – moisturizing vitamin c, potassium, amino acids & nourishing body oils -exfoliating salt scrub for body - win against aging & dead skin scars- 10 oz",$6.95 ($0.70 / Fl Oz),$8.99 ($0.90 / Fl Oz),https://www.amazon.com/dp/B09Z7FK957,3.4,98.0,artnaturals,1.0,body scrub
B0BYJC6YZR,"pjordo 4 pcs clay mask set, turmeric vitamin c clay mask, dead sea mud mask, avocado clay mask, rose clay mask, face mask skin care set, self care gifts for women, 2.82 oz each",$15.99 ($1.42 / Ounce),,https://www.amazon.com/dp/B0BYJC6YZR,4.1,17.0,pjordo,1.0,clay mask
B0B9MPNDHF,"pjordo clay mask kit, turmeric vitamin c clay mask, avocado clay mask, rose clay mask, facial mask skin care set for deep cleansing reduce blackheads acne dark spots, gifts for women, 240g in total",$13.99 ($1.65 / Ounce),$22.99 ($2.72 / Ounce),https://www.amazon.com/dp/B0B9MPNDHF,4.4,73.0,pjordo,1.0,clay mask
B0B9MYHHTM,"pjordo rose clay facial mask, face skin care clay mask, pink clay mask with mask brush for deep cleansing, anti-acne, refining pores soothing and brightening, spa facial mask 150g/5.29 oz",$8.99 ($1.70 / Ounce),,https://www.amazon.com/dp/B0B9MYHHTM,4.1,66.0,pjordo,1.0,clay mask
B071FCC3Y5,"plant therapy oil facial cleanser for normal/dry skin 4 oz, gently removes dirt, makeup & other impurities",$14.49 ($3.62 / Fl Oz),,https://www.amazon.com/dp/B071FCC3Y5,4.6,20.0,plant therapy,1.0,cleansing oil
B097Z1G9S6,"planty exfoliating body scrub with ahas - glycolic acid & lactic acid - for rough skin and uneven skin tone, 8 0z",$19.99 ($19.99 / Fl Oz),,https://www.amazon.com/dp/B097Z1G9S6,4.4,75.0,planty,1.0,body scrub
B0C87JTLCJ,"pond's clear solution, foaming face wash, removes excess oil, face cleanser, 3-pack of 1.07 fl oz each",$3.89,,https://www.amazon.com/dp/B0C87JTLCJ,4.8,6.0,pond's,1.0,cleanser
B0B58QXD1Z,pop modern.c turmeric vitamin c clay mask deep cleansing face mask skin care improve blackheads acne dark spots and even out skin tone facial mask control oil and refining pores,$9.99 ($2.36 / Ounce),,https://www.amazon.com/dp/B0B58QXD1Z,4.3,421.0,pop modern.c,1.0,clay mask
B08YH26B9Y,"poppy & pout 100% natural lip balm, 0.3oz cardboard tube, hand-filled - beeswax, vitamin e, organic coconut oil, cruelty free (blood orange mint)",$9.95,,https://www.amazon.com/dp/B08YH26B9Y,4.5,1042.0,poppy & pout,1.0,lipbalm
B0CFG5F4TV,"praiasol super c serum, vibrance vitamin c serum for face, vibrance vit c serum for mature skin, serum vitamina c, vitamin c face serum targets age spots, wrinkles, smooths skin.1 fl oz",$22.99 ($22.99 / Fl Oz),,https://www.amazon.com/dp/B0CFG5F4TV,4.8,69.0,praiasol,1.0,serum
B07W5MP67Z,premier anti-aging duo the cleansing balm 90g (clear),$33.99 ($33.99 / Count),$39.99 ($39.99 / Count),https://www.amazon.com/dp/B07W5MP67Z,4.3,2881.0,duo,1.0,cleansing balm
B09TVZNLG4,"premium 20% 𝐯𝐢𝐭𝐚𝐦𝐢𝐧 𝐜 𝐬𝐞𝐫𝐮𝐦 - (2pack) with hyaluronic acid, retinol & amino acids - boost skin collagen,hydrate & plump skin, anti aging & wrinkle facial serum",$9.99 ($5.00 / Fl Oz),$11.99 ($6.00 / Fl Oz),https://www.amazon.com/dp/B09TVZNLG4,4.3,14349.0,elbbub,1.0,serum
B0011802T4,"pro tan, get buffed, pre-tan body scrub, skin balancing exfoliator, balance skin ph, 8 oz.",$22.95 ($2.87 / Fl Oz),,https://www.amazon.com/dp/B0011802T4,4.5,184.0,"pro tan, get buffed,",1.0,body scrub
B004DOYM2Q,"proactiv acne cleanser - benzoyl peroxide face wash and acne treatment - daily facial cleanser and hyularonic acid moisturizer with exfoliating beads - 90 day supply, 6 oz",$37.50 ($6.25 / Fl Oz),,https://www.amazon.com/dp/B004DOYM2Q,4.7,9272.0,proactiv,1.0,cleanser
B07L9YL7NX,"prociv 16 packs steam eye masks for dry eyes, spa warm eye mask, relief eye fatigue hot sleep eye mask for puffy eyes mask (unscented)",$16.99 ($1.06 / Count),$25.99 ($1.62 / Count),https://www.amazon.com/dp/B07L9YL7NX,4.4,2553.0,prociv,1.0,eye mask
B0BW2VWYHR,"protective cover for oculus/meta quest 2 accessories, silicone controllers grip cover protector, soft shell skin with face cover and lens cover by gwyoneaon (white)",$18.98,,https://www.amazon.com/dp/B0BW2VWYHR,4.5,114.0,gwyoneaon,1.0,face scrub
B00KMCEA4S,"pura d'or 20% vitamin c serum (4oz best value) lightweight maximum strength formula,hyaluronic acid,retinol,professional grade treatment for face & eyes,dark spots,acne,wrinkles,for men & women",$11.89 ($2.97 / Fl Oz),$16.99 ($4.25 / Fl Oz),https://www.amazon.com/dp/B00KMCEA4S,4.4,5925.0,pura d'or,1.0,serum
B00SSMEA4O,"pure body naturals pure bentonite powder for diy detox bath & facial mask, pure indian healing clay for burns, mastitis, inflamed or chapped skin (8.0 oz)",$7.49 ($0.94 / Ounce),,https://www.amazon.com/dp/B00SSMEA4O,4.5,6967.0,pure body naturals,1.0,clay mask
B07JH3YZKP,"purescrubs premium organic body scrub set - large 16oz unscented body scrub - dead sea salt infused organic essential oils & nutrients, includes wooden spoon, loofah & organic exfoliating bar soap",$28.95 ($1.81 / Ounce),,https://www.amazon.com/dp/B07JH3YZKP,4.6,9948.0,purescrubs,1.0,body scrub
B07M5PKHWX,"purescrubs premium organic brown sugar vanilla face & body scrub set - large 16oz, infused with organic essential oils, glycolic acid & includes wooden spoon, loofah & mini exfoliating bar soap",$28.95 ($1.81 / Ounce),,https://www.amazon.com/dp/B07M5PKHWX,4.6,1473.0,purescrubs,1.0,body scrub
B086WVRZBJ,"purito essential oil-free deep sea pure water cream 50g/1.7fl.oz, moisture cream for face, facial watery cream, vegan",$15.63 ($8.88 / Ounce),$16.80 ($9.55 / Ounce),https://www.amazon.com/dp/B086WVRZBJ,4.6,1711.0,purito,1.0,moisturizer
B07BQMN4QD,"purito centella green level eye cream /1fl.oz/dark circles/around eyes/wrinkles/puffiness that reduces eye bags, fine lines",$11.91,,https://www.amazon.com/dp/B07BQMN4QD,4.5,1020.0,purito,1.0,eye cream
