ASIN,product_name,price,listPrice,detailPageURL,rating,totalReviews,product_company,isPrimeEligible,Category
B071FPLRGS,"i dew care sheet mask pack - let’s get sheet faced | 14-day intense skincare makeover with collagen, tea tree oil, eucalyptus, lotus flower, 14 count",$21.25 ($1.52 / Count),$27.00 ($1.93 / Count),https://www.amazon.com/dp/B071FPLRGS,4.7,1929.0,i dew care,1.0,sheet mask
B0BS4CHYKY,"ilia - plant-based bright start activated eye cream | cruelty-free, vegan, clean beauty (0.5 oz | 15 ml)",$46.00 ($92.00 / Ounce),,https://www.amazon.com/dp/B0BS4CHYKY,4.4,43.0,ilia,1.0,eye cream
B077RTL1HJ,"illiyoon ceramide ato concentrate cream 200ml, 6.76 fl oz",$18.20 ($2.68 / Ounce),$24.99 ($3.68 / Ounce),https://www.amazon.com/dp/B077RTL1HJ,4.6,855.0,illiyoon,1.0,moisturizer
B086PSQ259,"i'm from fig boosting essence 150ml - hydrating & smoothening moisturizer for all skin types, natural & lightweight",$21.99 ($4.34 / Fl Oz),$35.00 ($6.90 / Fl Oz),https://www.amazon.com/dp/B086PSQ259,4.4,135.0,i'm from,1.0,essence
B086P94PJJ,"i'm from fig cleansing balm 100ml, korean makeup remover, vegan, easy to rinse off, fig oil water 7.8% with peptide and amino acid, makeup meltaway, makeup melting balm to oil",$22.75 ($6.69 / Ounce),$29.90 ($8.79 / Ounce),https://www.amazon.com/dp/B086P94PJJ,4.5,380.0,i'm from,1.0,cleansing balm
B07PSJBZ42,"image skincare i mask hydrating hydrogel sheet mask, hydro facial mask is refreshing, hydrating and soothing with hyaluronic acid, 2 oz",$10.00,,https://www.amazon.com/dp/B07PSJBZ42,4.6,231.0,image skincare i mask,1.0,sheet mask
B00T58BLJ2,"image skincare, clear cell salicylic gel cleanser, gentle foaming face wash removes excess oil and shine for oily prone skin, 6 oz",$36.00 ($6.00 / Fl Oz),,https://www.amazon.com/dp/B00T58BLJ2,4.7,1127.0,"image skincare, clear cell",1.0,cleanser
B003RJ165Y,"image skincare, vital c hydrating facial cleanser, gentle face wash with vitamin c, e and a, 6 fl oz",$38.00 ($6.33 / Fl Oz),,https://www.amazon.com/dp/B003RJ165Y,4.7,2761.0,"image skincare, vital c",1.0,cleanser
B00FU6QX96,"image skincare, vital c hydrating serum, with potent vitamin c to brighten, tone and smooth appearance of wrinkles, 1.7 fl oz",$82.00 ($48.24 / Ounce),,https://www.amazon.com/dp/B00FU6QX96,4.7,2017.0,"image skincare, vital c",1.0,serum
B07D8H88TM,"image skincare, vital c hydrating vitamin a c e serum, brightening complex, 1 fl oz",$74.00,,https://www.amazon.com/dp/B07D8H88TM,4.7,394.0,"image skincare, vital c",1.0,serum
B08WZPZHCR,"innisfree cherry blossom dewy glow jelly cream face moisturizer , 1.69 fl oz (pack of 1)",$26.00 ($15.29 / Fl Oz),,https://www.amazon.com/dp/B08WZPZHCR,4.4,1772.0,innisfree cherry blossom dewy,1.0,moisturizer
B08WZS7LVN,"innisfree daily uv defense sunscreen broad spectrum spf 36 face lotion, 1.69 fl oz (pack of 1)",$16.00 ($9.47 / Fl Oz),,https://www.amazon.com/dp/B08WZS7LVN,4.7,4301.0,innisfree daily uv defense,1.0,sunscreen
B09CQHJB4M,"innisfree green tea hyaluronic acid hydrating serum: hydrate, visibly soothe and support the moisture barrier",$30.00 ($11.11 / Fl Oz),,https://www.amazon.com/dp/B09CQHJB4M,4.7,924.0,innisfree green tea hyaluronic,1.0,serum
B0BLCXVYZQ,"innisfree green tea hydrating cleansing oil: antioxidant, amino acid rich, hydration, non-stripping",$24.00 ($4.73 / Fl Oz),,https://www.amazon.com/dp/B0BLCXVYZQ,4.6,237.0,innisfree green tea hydrating,1.0,cleansing oil
B099P4QM2X,"innisfree my real squeeze mask face sheet masks, green tea, 6-pack, 6 ct.",$11.00 ($1.83 / Count),,https://www.amazon.com/dp/B099P4QM2X,4.6,187.0,innisfree my real squeeze,1.0,sheet mask
B08WZRDXK8,innisfree orchid youth enriched eye cream hyaluronic acid moisturizer,$29.00,,https://www.amazon.com/dp/B08WZRDXK8,4.5,331.0,innisfree orchid youth enriched,1.0,eye cream
B08WZRDXK7,"innisfree pore clearing clay mask 2x super volcanic clusters face treatment , 3.38 fl oz (pack of 1)",$16.00 ($4.73 / Fl Oz),,https://www.amazon.com/dp/B08WZRDXK7,4.6,2663.0,innisfree pore clearing clay,1.0,clay mask
B08WZS292S,"innisfree pore clearing facial foam with volcanic clusters face cleanser, 5.07 fl oz (pack of 1)",$14.00 ($0.44 / Fl Oz),,https://www.amazon.com/dp/B08WZS292S,4.6,1173.0,innisfree pore clearing facial,1.0,cleanser
B08MMYW9Q6,"instanatural brightening vitamin c face scrub, gently exfoliates and refines for smooth skin, minimizes lines + wrinkles, with green tea and aloe vera, 2 fl oz",$16.95 ($8.48 / Fl Oz),$20.00 ($10.00 / Fl Oz),https://www.amazon.com/dp/B08MMYW9Q6,4.3,3594.0,instanatural,1.0,exfoliator
B00VMYKCL0,"instanatural vitamin c cleanser face wash, brightens and reduces signs of aging, fine lines and uneven texture, with coconut water and aloe vera, 6.7 fl oz",$24.95 ($3.72 / Fl Oz),$29.00 ($4.33 / Fl Oz),https://www.amazon.com/dp/B00VMYKCL0,4.4,18177.0,instanatural,1.0,cleanser
B007PFIOUQ,"is clinical active serum; face serum, helps skin with acne, 1 fl oz",$142.00,,https://www.amazon.com/dp/B007PFIOUQ,4.6,704.0,is clinical active serum;,1.0,serum
B0026TOCK2,"is clinical cleansing complex, 3in1 gentle deep pore cleanser face wash and makeup remover. helps acne and blemish-prone skin",$45.00 ($7.50 / Fl Oz),,https://www.amazon.com/dp/B0026TOCK2,4.6,2157.0,"is clinical cleansing complex,",1.0,cleanser
B09ZHHV1CN,isntree hyaluronic acid watery sun gel 50ml 1.69fl.oz,$16.99 ($10.05 / Fl Oz),,https://www.amazon.com/dp/B09ZHHV1CN,4.6,781.0,isntree,1.0,sunscreen
B07KQYWBP7,isntree mugwort calming clay mask 100ml 3.38 fl.oz | effective sebum control | exfoliates rough skin,$18.89 ($5.56 / Fl Oz),$22.20 ($6.53 / Fl Oz),https://www.amazon.com/dp/B07KQYWBP7,4.6,274.0,isntree,1.0,clay mask
B09RND9RRY,"it cosmetics bye bye makeup cleansing balm - 3-in-1 makeup remover, facial cleanser & hydrating facial mask - with vitamin c, ceramides, shea butter & rosehip oil - 4 oz",$46.00 ($11.50 / Ounce),,https://www.amazon.com/dp/B09RND9RRY,4.5,147.0,it cosmetics bye bye,1.0,cleansing balm
B09QH7C86G,"it cosmetics confidence in an eye cream, anti aging eye cream for dark circles, crow's feet, lack of firmness & dryness, 48hr hydration with 2% super peptide concentrate, for day + night - 0.5 fl oz",$47.50 ($95.00 / Fl Oz),,https://www.amazon.com/dp/B09QH7C86G,4.4,427.0,it cosmetics confidence in,1.0,eye cream
B0B79QQZMC,iunik centella calming vegan moisture spf 50+ pa++++ non-sticky no white cast light-weight daily sunscreen reef-safe uva uvb matte-finish no-scent 2 oz beta-glucan dry oily sensitive acne-prone skin korean skincare,$14.50 ($7.18 / Fl Oz),$19.99 ($9.90 / Fl Oz),https://www.amazon.com/dp/B0B79QQZMC,4.5,210.0,iunik,1.0,sunscreen
B07NMLCB1H,"iunik tea tree 67% relief vegan facial serum for clear & balanced skin - plant-based ingredients w/centella asiatica for soothing, calming, irritated skin - korean skincare for sensitive oily skin",$16.99 ($9.99 / Fl Oz),,https://www.amazon.com/dp/B07NMLCB1H,4.5,3326.0,iunik,1.0,serum
B08TZ2G8TD,"j.r. watkins sleep sugar body polish, monoi & sandalwood natural body scrub cleanses & encourages restful sleep, 6 oz",$4.39 ($0.73 / Fl Oz),$13.99 ($2.33 / Fl Oz),https://www.amazon.com/dp/B08TZ2G8TD,4.5,147.0,j.r. watkins,1.0,body scrub
B000HP9M3E,"jack black double-duty face moisturizer spf 20, 3.3 fl. oz (pack of 1)",$30.00 ($9.09 / Fl Oz),,https://www.amazon.com/dp/B000HP9M3E,4.7,8174.0,jack black double-duty face,1.0,moisturizer
B07QYWXCCT,"jack black,intense therapy lip balm spf 25,green tea antioxidants,long lasting treatment,broad-spectrum uva and uvb protection,natural mint & shea butter flavor,0.25 ounce,pack of 3 -amazon exclusive",$24.00 ($32.00 / Ounce),$30.00 ($40.00 / Ounce),https://www.amazon.com/dp/B07QYWXCCT,4.7,21193.0,"jack black,intense therapy lip",1.0,lipbalm
B082GDCJ5T,"jakuva 30 pairs 24k gold gel collagen eye mask,under eye patches for puffy eyes,dark circles & reduce wrinkles,moisturizing for face care, eye pads for your beauty skin care",$8.99 ($0.30 / Count),$18.99 ($0.63 / Count),https://www.amazon.com/dp/B082GDCJ5T,4.5,1911.0,jakuva,1.0,eye mask
B0BSTP6CRX,japanese makeup mukaiami kose softymo speedy cleansing oil 200ml refill pack x 3 packs including oil blotting papers,$31.00 ($4.40 / Fl Oz),,https://www.amazon.com/dp/B0BSTP6CRX,4.9,14.0,japanese makeup mukaiami,1.0,cleansing oil
B0C3B5MT5G,"jeosisy clay mask-face dead sea mud mask,green tea mud mask,purifying pore,remove blackheads,control oil,anti aging,brightening and moisturizing,facial clay mask gift sets for women and men-2.8oz*2",$7.99 ($1.42 / Ounce),$8.99 ($1.59 / Ounce),https://www.amazon.com/dp/B0C3B5MT5G,4.6,28.0,jeosisy,1.0,clay mask
B0034F9K36,"jergens ultra healing dry skin moisturizer, body and hand lotion for dry skin, for quick absorption into extra dry skin, with hydralucence blend, vitamins c, e, and b5, 32 ounce",$10.47 ($0.33 / Ounce),$12.24 ($0.38 / Ounce),https://www.amazon.com/dp/B0034F9K36,4.8,33564.0,jergens,1.0,moisturizer
B0BQ1WK8V6,"joli noir - brightening turmeric scrub with honey, cinnamon & vitamin e - fragrance free exfoliating face sugar scrub - for acne, hyperpigmentation & dullness - 3 ounces",$9.99 ($3.33 / Ounce),,https://www.amazon.com/dp/B0BQ1WK8V6,4.4,150.0,joli noir,1.0,face scrub
B088K23418,julep 24/7 lip treatment - hydrating lip balm and lip sleeping mask - moisturizing lip repair - soothe dry chapped lips - shea butter,$12.00 ($29.27 / Fl Oz),,https://www.amazon.com/dp/B088K23418,4.4,645.0,julep,1.0,lipbalm
B09DSQB2Y5,julep it's balm: tinted lip balm + buildable lip color - 90's neutral - natural gloss finish - hydrating vitamin e core - vegan,$14.00,,https://www.amazon.com/dp/B09DSQB2Y5,4.1,8734.0,julep,1.0,lipbalm
B07QSF1LK3,"jumiso all day vitamin serum, brightening & balancing facial serum, mother's day, gift, vitamin c, a, b, d, e , serum with vitamin, korean skincare, skin brightening, soothing, vegan serum, vitamin tree extract 86.14%, niacinamide 20,000ppm,1.01 fl oz (serum)",$14.03 ($13.89 / Fl Oz),$19.00 ($18.81 / Fl Oz),https://www.amazon.com/dp/B07QSF1LK3,4.4,1126.0,jumiso,1.0,serum
B0BN4P6LBP,juno & co. 10 ingredients cleansing balm and clarifying cleansing powder,$30.99,$32.98,https://www.amazon.com/dp/B0BN4P6LBP,4.9,50.0,juno & co.,1.0,cleansing balm
B08Q3CQM7X,juno & co. clean 10 cleansing balm 10 ingredients makeup remover 85g / 3.0oz,$14.99 ($5.00 / Ounce),$19.99 ($6.66 / Ounce),https://www.amazon.com/dp/B08Q3CQM7X,4.6,14885.0,juno & co.,1.0,cleansing oil
B09WYP8QS4,"juno & co. exfoliating face wash, 10 ingredients facial clarifying cleansing powder with hyaluronic acid for extra hydration 50g / 1.76oz",$17.99 ($10.22 / Ounce),,https://www.amazon.com/dp/B09WYP8QS4,4.4,531.0,juno & co.,1.0,cleansing balm
B07FY45C46,"kao megurism health care steam warm eye mask, made in japan, no fragrance, 12 count (pack of 1)",$11.99 ($1.00 / Count),,https://www.amazon.com/dp/B07FY45C46,4.5,3249.0,kao megurism health care,1.0,eye mask
B07FXQSRN4,"kao megurism health care steam warm eye mask,made in japan, lavender sage 12 sheets",$12.48 ($1.04 / Count),,https://www.amazon.com/dp/B07FXQSRN4,4.6,2741.0,kao megurism health care,1.0,eye mask
B07FXTHRD3,"kao megurism health care steam warm eye mask,made in japan, rose 12 sheets×2boxes",$21.80 ($0.91 / Count),,https://www.amazon.com/dp/B07FXTHRD3,4.7,830.0,kao megurism health care,1.0,eye mask
B09L3C9WY5,"karuna tone sheet mask - hydrating toner face mask, face toner for women, anti aging face mask black hoof mushroom adaptogen to balance & protect skin, improve tone & get rid of fine lines 0.74 fl.oz./22 ml.",$6.00 ($6.00 / Count),,https://www.amazon.com/dp/B09L3C9WY5,4.6,606.0,karuna,0.0,sheet mask
B01MDT786Y,"kiehl's age defender eye repair cream for men, 0.5 ounce",$36.94 ($73.88 / Ounce),$40.66 ($81.32 / Ounce),https://www.amazon.com/dp/B01MDT786Y,4.5,164.0,kiehl's,1.0,eye cream
B09P5ZRNVF,"kiehl's creamy eye treatment with avocado - 7 ml, travel size",$10.00 ($50.00 / Fl Oz),,https://www.amazon.com/dp/B09P5ZRNVF,4.3,1317.0,kiehl's,1.0,eye cream
B07ZZYMWDT,"kiehl's creamy eye treatment with avocado, 14 g",$30.00 ($61.22 / Ounce),,https://www.amazon.com/dp/B07ZZYMWDT,4.3,1736.0,kiehl's,0.0,eye cream
B0C32W143F,"kiehl's ferulic brew rejuvenating facial essence, 3.4 fl oz / 100 ml",$31.46,,https://www.amazon.com/dp/B0C32W143F,4.8,21.0,kiehl's,1.0,essence
B0BMP8TBVV,"kiehl's powerful-strength dark circle reducing vitamin c eye serum, 0.5 ounce, 42 grams",$29.99 ($59.98 / Ounce),,https://www.amazon.com/dp/B0BMP8TBVV,4.1,55.0,kiehl's,1.0,eye cream
B01KSIO76G,"kiehl's rare earth deep pore cleansing amazonian white clay mask, 0.95 ounce",$26.89 ($28.31 / Ounce),,https://www.amazon.com/dp/B01KSIO76G,4.4,188.0,kiehl's,1.0,clay mask
B0CBP57936,"kimtrue makeup remover cleansing balm and gentle eye and lip makeup remover and makeup cleansing oil (travel size x 2, 15g*2)",$7.99 ($15.10 / Ounce),,https://www.amazon.com/dp/B0CBP57936,4.5,585.0,kimtrue,1.0,cleansing balm
B07DKJDJMH,"kind lips lip balm, nourishing soothing lip moisturizer for dry cracked chapped lips, made in usa with 100% natural usda organic ingredients, sweet mint flavor, pack of 3",$9.79 ($3.26 / Count),,https://www.amazon.com/dp/B07DKJDJMH,4.6,1714.0,kind lips,1.0,lipbalm
B000RYH38Q,"kinesys fragrance free clear spray sunscreen for sensitive skin, spf 30, hypoallergenic, broad spectrum uva/uvb protection for face & body alcohol, paba and oxybenzone free, 700 sprays, 4 fl. oz",$25.99 ($6.50 / Fl Oz),,https://www.amazon.com/dp/B000RYH38Q,4.4,1682.0,kinesys performance sunscreen,1.0,sunscreen
B01DC6XTYC,"kleem organics retinol cream for face - anti aging face cream with hyaluronic acid & collagen - retinol face moisturizer for wrinkles, dark spots, and uneven skin texture - crema retinol para la cara",$26.97 ($15.86 / Ounce),$35.00 ($20.59 / Ounce),https://www.amazon.com/dp/B01DC6XTYC,4.4,27603.0,kleem organics,1.0,moisturizer
B0BW2XP5JW,"know beauty glacial bay clay mask with canadian colloidal clay - remove impurities, tighten pores, improve radiance, gentle and hydrating for acne and oily skin - with lactic acid and giant sea kelp",$45.00 ($26.47 / Ounce),,https://www.amazon.com/dp/B0BW2XP5JW,4.5,198.0,knowbeauty,1.0,clay mask
B09NS6HSTB,"kopari kp body bumps be gone exfoliating body scrub with 10% aha, to smooth skin, reduce bumps, decongest pores, clarifying, gently exfoliate & wash | 8.45 fl oz tube",$26.99 ($3.19 / Fl Oz),,https://www.amazon.com/dp/B09NS6HSTB,4.4,881.0,kopari,1.0,body scrub
B0BRKNN8SB,"korean exfoliating mitt, korintin 1pcs exfoliating body gloves clean dead skin at home, great for spray tan removal or keratosis pilaris",$3.29 ($3.29 / Count),,https://www.amazon.com/dp/B0BRKNN8SB,3.7,58.0,korintin,1.0,exfoliator
B084G2D2DX,"korres greek yoghurt foaming cream cleanser 150 ml, 5.01 fl. oz.",$28.00 ($5.59 / Fl Oz),,https://www.amazon.com/dp/B084G2D2DX,4.7,1363.0,korres greek yoghurt foaming,1.0,cleanser
B0B8TJQ3PY,"kosbeauty dr. jart mask sheet set 7 pcs random(brightening, ceramidin, clearing, firming, peeling, porecting, soothing, tiger calming, vital hydra, wrinkle), skincare, facial care",$23.99 ($3.43 / Count),,https://www.amazon.com/dp/B0B8TJQ3PY,4.7,97.0,kosbeauty,1.0,sheet mask
B000V2FB88,"kose softy mo deep treatment oil, 7.8oz",$11.59 ($1.49 / Fl Oz),$13.99 ($1.79 / Fl Oz),https://www.amazon.com/dp/B000V2FB88,4.4,3029.0,kose,1.0,cleansing oil
B002IT6GWW,kose softy mo white cleansing oil refill,$8.83 ($1.10 / Ounce),$11.99 ($1.50 / Ounce),https://www.amazon.com/dp/B002IT6GWW,4.6,51.0,kose,1.0,cleansing oil
B002IT6GVS,kose softymo deep cleansing oil makeup remover (refill) 200ml,$9.98 ($1.48 / Fl Oz),,https://www.amazon.com/dp/B002IT6GVS,4.6,606.0,kose,1.0,cleansing oil
B002IT6GTU,kose softymo speedy cleansing oil 200ml refill pack,$14.97 ($2.21 / Fl Oz),,https://www.amazon.com/dp/B002IT6GTU,4.7,1944.0,kose cosmeport,1.0,cleansing oil
B0CF1R2Z5C,"kp bump eraser body scrub, exfoliating body scrub, body exfoliator scrub, kp body scrub for women strawberry legs, effective body scrubs for women exfoliation bump eraser",$19.99 ($2.46 / Fl Oz),,https://www.amazon.com/dp/B0CF1R2Z5C,4.8,243.0,ciz,1.0,exfoliator
B0BXDC96G5,"kp bump eraser body scrub, keratosis pilaris treatment, strawberry legs treatment for women, bump eraser body scrub, keratosis pilaris, body scrub for strawberry legs",$18.99 ($4.72 / Fl Oz),,https://www.amazon.com/dp/B0BXDC96G5,4.2,88.0,rida hair research institute,1.0,body scrub
B01CTJU09A,"la prairie cellular swiss uv protection veil spf 50 women's sunscreen, 1.7 fl oz",$185.49 ($109.11 / Ounce),,https://www.amazon.com/dp/B01CTJU09A,4.0,58.0,la prairie,1.0,sunscreen
B016OVYT3W,"la pure 24k gold eye treatment masks - under eye patches, under eye bags treatment, eye mask for puffy eyes, anti-wrinkle, dark circles, gel pads 15 pairs",$17.47 ($1.16 / Count),$29.95 ($2.00 / Count),https://www.amazon.com/dp/B016OVYT3W,4.3,7094.0,la pure,1.0,eye mask
B06VV8FBDQ,"la pure korean face mask - hydrating beauty snail mask, anti-wrinkle skin care, anti-aging sheets pack, hydration deep moisturizing facemask, 10 facial masks for women & men",$30.95 ($3.10 / Count),,https://www.amazon.com/dp/B06VV8FBDQ,4.6,3449.0,la pure,1.0,sheet mask
B01A0NT3D6,"la roche-posay anthelios clear skin dry touch sunscreen spf 60, oil free face sunscreen for acne prone skin, won't cause breakouts, non-greasy, oxybenzone free",$19.99 ($11.76 / Fl Oz),,https://www.amazon.com/dp/B01A0NT3D6,4.4,15373.0,la roche-posay anthelios clear,1.0,sunscreen
B00TBJWP9K,"la roche-posay anthelios cooling water lotion sunscreen for body and face, broad spectrum sunscreen spf, absorbs quickly, water resistant every day sun protection for sensitive skin",$37.99 ($7.60 / Fl Oz),,https://www.amazon.com/dp/B00TBJWP9K,4.7,1608.0,la roche-posay anthelios cooling,1.0,sunscreen
B002CML1XE,"la roche-posay anthelios light fluid face sunscreen broad spectrum spf 60, sensitive skin sunscreen, oxybenzone free, oil free, non-comedogenic",$32.99 ($19.41 / Fl Oz),,https://www.amazon.com/dp/B002CML1XE,4.7,6216.0,la roche-posay anthelios light,1.0,sunscreen
B07YGVSGMW,"la roche-posay anthelios melt-in milk body & face sunscreen lotion broad spectrum spf 100, oxybenzone & octinoxate free, sunscreen for kids, adults & sun sensitive skin, unscented, 3 fl oz",$26.99 ($9.00 / Fl Oz),,https://www.amazon.com/dp/B07YGVSGMW,4.7,7614.0,la roche-posay anthelios melt-in,1.0,sunscreen
B002CML1VG,"la roche-posay anthelios melt-in milk body & face sunscreen spf 60, oil free sunscreen for sensitive skin, sport sunscreen lotion, sun protection & sun skin care, oxybenzone free",$36.99 ($7.40 / Fl Oz),,https://www.amazon.com/dp/B002CML1VG,4.6,12200.0,la roche-posay anthelios melt-in,1.0,sunscreen
B07HF7VMXZ,"la roche-posay anthelios mineral sunscreen gentle lotion broad spectrum spf 50, face and body sunscreen with zinc oxide and titanium dioxide, oxybenzone & octinoxate free, oil-free",$25.99 ($8.66 / Fl Oz),,https://www.amazon.com/dp/B07HF7VMXZ,4.2,2474.0,la roche-posay anthelios mineral,1.0,sunscreen
B007EUSL5U,"la roche-posay anthelios ultra-light sunscreen lotion spray broad spectrum spf 60, alcohol-free, oil-free, water resistant, 5 fl. oz.",$26.99 ($5.40 / Ounce),,https://www.amazon.com/dp/B007EUSL5U,4.4,2444.0,la roche-posay anthelios ultra-light,1.0,sunscreen
B06XH1WJNR,"la roche-posay effaclar clarifying clay face mask for oily skin, unclogs pores and controls shine without over-drying, packaging may vary",$21.99 ($6.47 / Fl Oz),,https://www.amazon.com/dp/B06XH1WJNR,4.6,1598.0,la roche-posay effaclar clarifying,1.0,clay mask
B00LO1DNXU,"la roche-posay effaclar medicated gel facial cleanser, foaming acne face wash with salicylic acid, helps clear acne breakouts and with oily skin control, oil free, fragrance free",$15.99 ($2.35 / Fl Oz),$16.99 ($2.50 / Fl Oz),https://www.amazon.com/dp/B00LO1DNXU,4.6,14476.0,la roche-posay effaclar medicated,1.0,cleanser
B003JSEGNC,"la roche-posay effaclar purifying foaming gel cleanser for oily skin, ph balancing daily face wash, oil free and soap free",$22.99 ($1.70 / Fl Oz),,https://www.amazon.com/dp/B003JSEGNC,4.7,31710.0,la roche-posay effaclar purifying,1.0,cleanser
B075VX4QVM,"la roche-posay hyalu b5 pure hyaluronic acid serum for face, with vitamin b5, anti-aging serum for fine lines and wrinkles, hydrating serum to plump and repair dry skin, safe on sensitive skin",$39.99,,https://www.amazon.com/dp/B075VX4QVM,4.6,21026.0,la roche-posay hyalu b5,1.0,serum
B003QXZWYW,"la roche-posay lipikar balm ap+ intense repair body lotion for dry skin, body cream with shea butter and niacinamide, moisturizer for dry and rough skin, sensitive skin safe, 13.52 fl oz (pack of 1)",$19.99 ($1.48 / Fl Oz),,https://www.amazon.com/dp/B003QXZWYW,4.7,21597.0,la roche-posay lipikar balm,1.0,moisturizer
B00B4RJP72,la roche-posay mat oil-free mattifying moisturizer,$35.99 ($25.71 / Fl Oz),,https://www.amazon.com/dp/B00B4RJP72,4.5,13725.0,la roche-posay mat oil-free,1.0,moisturizer
B0C673PKK3,la roche-posay new lipikar ap+ gentle foaming cleansing oil | gentle oil cleanser for face and body formulated with niacinamide | long-lasting 24-hour hydration | fragrance-free & soap free,$16.99 ($1.26 / Fl Oz),,https://www.amazon.com/dp/B0C673PKK3,4.5,165.0,la roche-posay new lipikar,1.0,cleansing oil
B09X2H4SLY,"la roche-posay niacinamide 10 face serum, brightening and anti-aging facial serum with 10% niacinamide, reduces the look of dark spots, discoloration, and uneven skin tone",$39.99,,https://www.amazon.com/dp/B09X2H4SLY,4.6,2113.0,la roche-posay niacinamide 10,1.0,serum
B002SMNBXG,"la roche-posay nutritic lip balm for very dry lips, soothes and repairs chapped lips with shea butter and ceramides, 0.15 fl oz (pack of 1)",$16.99,,https://www.amazon.com/dp/B002SMNBXG,4.4,2071.0,la roche-posay nutritic lip,1.0,lipbalm
B07Z9Y4M3C,"la roche-posay pure retinol face serum with vitamin b3. anti aging face serum for lines, wrinkles & premature sun damage to resurface & hydrate. suitable for sensitive skin, 1.0 fl. oz",$44.99 ($44.54 / Fl Oz),,https://www.amazon.com/dp/B07Z9Y4M3C,4.6,8341.0,la roche-posay pure retinol,1.0,serum
B00VGCXN0U,"la roche-posay toleriane dermallergo eye cream soothing repair moisturizer, soothes and comforts sensitive skin, allergy tested, fragrance free, alcohol free, formerly toleriane ultra eyes",$29.99 ($42.84 / Fl Oz),,https://www.amazon.com/dp/B00VGCXN0U,4.5,3028.0,la roche-posay toleriane dermallergo,1.0,eye cream
B09N13T8TL,"la roche-posay toleriane double repair matte face moisturizer, daily gel moisturizer for oily skin control with niacinamide, oil-free, non-comedogenic, moisturizing for sensitive skin",$21.99 ($8.66 / Fl Oz),,https://www.amazon.com/dp/B09N13T8TL,4.5,4174.0,la roche-posay toleriane double,1.0,moisturizer
B01N7T7JKJ,"la roche-posay toleriane hydrating gentle face cleanser, daily facial cleanser with niacinamide and ceramides for sensitive skin, moisturizing face wash for normal to dry skin, fragrance free",$16.99 ($1.26 / Fl Oz),,https://www.amazon.com/dp/B01N7T7JKJ,4.6,28107.0,la roche-posay toleriane hydrating,1.0,cleanser
B01N34XW93,"la roche-posay toleriane purifying foaming facial, oil free face wash for oily skin and for sensitive skin with niacinamide, pore cleanser wonâ€™t dry out skin, unscented",$16.99 ($1.26 / Fl Oz),,https://www.amazon.com/dp/B01N34XW93,4.7,28321.0,la roche-posay toleriane purifying,1.0,cleanser
B002WDKJZO,"la roche-posay ultra-fine scrub for sensitive skin, gentle exfoliating face wash with ultra-fine pumice particles to remove dead skin",$19.99 ($11.83 / Fl Oz),,https://www.amazon.com/dp/B002WDKJZO,4.4,3045.0,la roche-posay ultra-fine scrub,1.0,exfoliator
B0165XUWGC,"lalicious sugar lavender extraordinary whipped sugar scrub - cane sugar body & foot scrub, exfoliating & moisturizing skin care with coconut oil & honey, no parabens (16oz)",$40.00 ($2.50 / Ounce),,https://www.amazon.com/dp/B0165XUWGC,4.7,1200.0,lalicious,1.0,body scrub
B01MQG6S6V,lancôme​ créme radiance cream-to-foam face cleanser - gently cleanses skin & removes makeup - with rose & lotus flower extract - 4.2 fl oz,$34.00 ($8.10 / Fl Oz),,https://www.amazon.com/dp/B01MQG6S6V,4.8,984.0,lancôme​ créme radiance cream-to-foam,1.0,cleanser
B07XXPHQZK,laneige lip sleeping mask - berry (packaging may vary),$24.00,,https://www.amazon.com/dp/B07XXPHQZK,4.7,32538.0,laneige lip sleeping mask,1.0,lipbalm
B07DN3HB2G,"lapcos aqua sheet mask, hydrating daily face mask with seawater and plankton extract to nourish skin, korean beauty favorite, 5-pack",$17.00 ($3.40 / Count),,https://www.amazon.com/dp/B07DN3HB2G,4.6,305.0,lapcos,1.0,sheet mask
B07D23BCKT,"lapcos charcoal sheet mask, daily face mask with salicylic acid and tea tree oil to detoxify and tighten skin, korean beauty favorite, 5-pack",$17.00 ($3.40 / Count),,https://www.amazon.com/dp/B07D23BCKT,4.4,372.0,lapcos,1.0,sheet mask
B07DN4H67T,"lapcos collagen sheet mask, firming daily face mask with collagen peptides for wrinkles & dark spots, korean beauty favorite, 5-pack",$17.00 ($3.40 / Count),,https://www.amazon.com/dp/B07DN4H67T,4.6,1704.0,lapcos,1.0,sheet mask
B07J4X9C51,"lapcos honey sheet mask, daily face mask with hyaluronic acid and antioxidants to hydrate and tighten dry skin, korean beauty favorite, 5-pack",$17.00 ($3.40 / Count),,https://www.amazon.com/dp/B07J4X9C51,4.6,696.0,lapcos,1.0,sheet mask
B07TKR69FD,"lapcos hyaluronic acid sheet mask, daily hydrating face mask, protects & nourishes skin, korean beauty favorite, 5-pack",$17.00 ($3.40 / Count),,https://www.amazon.com/dp/B07TKR69FD,4.6,768.0,lapcos,1.0,sheet mask
B07H76M36L,"lapcos milk sheet mask, moisturizing daily face mask to replenish and restore dry skin, korean beauty favorite, 5-pack",$17.00 ($3.40 / Count),,https://www.amazon.com/dp/B07H76M36L,4.6,284.0,lapcos,1.0,sheet mask
